display,encoding_trial_num,group,trial_num,encoding_sentence.arms_cook,encoding_sentence.musi_cook,encoding_sentence.gems_cook,encoding_sentence.arms_cars,encoding_sentence.musi_cars,encoding_sentence.gems_cars,encoding_sentence.arms_dino,encoding_sentence.musi_dino,encoding_sentence.gems_dino,mp3.arms_cook,mp3.musi_cook,mp3.gems_cook,mp3.arms_cars,mp3.musi_cars,mp3.gems_cars,mp3.arms_dino,mp3.musi_dino,mp3.gems_dino,pic_a.arms_cook,pic_a.musi_cook,pic_a.gems_cook,pic_a.arms_cars,pic_a.musi_cars,pic_a.gems_cars,pic_a.arms_dino,pic_a.musi_dino,pic_a.gems_dino,pic_b.arms_cook,pic_b.musi_cook,pic_b.gems_cook,pic_b.arms_cars,pic_b.musi_cars,pic_b.gems_cars,pic_b.arms_dino,pic_b.musi_dino,pic_b.gems_dino
memorise_secondhalf,59,academic,30,"Samurai carried a series of personal care tools in their sword and armor mounting for use off the battlefield. One of these was the kogai, a large hairpin used for putting long hair into a bun. The kogai slipped neatly into a slot on the samurai's katana scabbard for safekeeping when not in use.","The Otamatone is an unusual eighth-note-shaped synthesizer invented in 2009 by Japanese artist team Maywa Denki. The Otamatone sounds by squeezing the head of the note to make it ""sing"" an electronic tone, and pressing along the stem of the note to modulate the pitch. It is named for a portmanteau of ""tone"" and the Japanese word for ""tadpole"", for its resemblance both to a tadpole and to a musical note.","Experts are capable of identifying a large number of gemstones simply by using a loupe with 10x magnification strength. Indeed, 10x is the international standard magnification level for grading the clarity of diamonds. 10x magnification is strong enough to see inclusions in most gemstones and thus identify them and determine their quality, without being so strong as to pick up negligibly small flaws.","Samurai carried a series of personal care tools in their sword and armor mounting for use off the battlefield. One of these was the kogai, a large hairpin used for putting long hair into a bun. The kogai slipped neatly into a slot on the samurai's katana scabbard for safekeeping when not in use.","The Otamatone is an unusual eighth-note-shaped synthesizer invented in 2009 by Japanese artist team Maywa Denki. The Otamatone sounds by squeezing the head of the note to make it ""sing"" an electronic tone, and pressing along the stem of the note to modulate the pitch. It is named for a portmanteau of ""tone"" and the Japanese word for ""tadpole"", for its resemblance both to a tadpole and to a musical note.","Experts are capable of identifying a large number of gemstones simply by using a loupe with 10x magnification strength. Indeed, 10x is the international standard magnification level for grading the clarity of diamonds. 10x magnification is strong enough to see inclusions in most gemstones and thus identify them and determine their quality, without being so strong as to pick up negligibly small flaws.","Samurai carried a series of personal care tools in their sword and armor mounting for use off the battlefield. One of these was the kogai, a large hairpin used for putting long hair into a bun. The kogai slipped neatly into a slot on the samurai's katana scabbard for safekeeping when not in use.","The Otamatone is an unusual eighth-note-shaped synthesizer invented in 2009 by Japanese artist team Maywa Denki. The Otamatone sounds by squeezing the head of the note to make it ""sing"" an electronic tone, and pressing along the stem of the note to modulate the pitch. It is named for a portmanteau of ""tone"" and the Japanese word for ""tadpole"", for its resemblance both to a tadpole and to a musical note.","Experts are capable of identifying a large number of gemstones simply by using a loupe with 10x magnification strength. Indeed, 10x is the international standard magnification level for grading the clarity of diamonds. 10x magnification is strong enough to see inclusions in most gemstones and thus identify them and determine their quality, without being so strong as to pick up negligibly small flaws.",arms30.mp3,musi30.mp3,gems30.mp3,arms30.mp3,musi30.mp3,gems30.mp3,arms30.mp3,musi30.mp3,gems30.mp3,arms30a.png,musi30a.png,gems30a.jpeg,arms30a.png,musi30a.png,gems30a.jpeg,arms30a.png,musi30a.png,gems30a.jpeg,arms30b.png,musi30b.png,gems30b.jpeg,arms30b.png,musi30b.png,gems30b.jpeg,arms30b.png,musi30b.png,gems30b.jpeg
memorise_secondhalf,60,nonacademic,30,"In French cooking, mirepoix is a mixture of diced carrots, onions, celery, and herbs that is sauteed in butter. It is often used to season soups, sauces, and stews, or as a bed to braise foods, such as meats or fish. Different versions include a white mirepoix, where carrots are omitted and mushrooms or parsnips are added, or the addition of ham or bacon to the mix.","In French cooking, mirepoix is a mixture of diced carrots, onions, celery, and herbs that is sauteed in butter. It is often used to season soups, sauces, and stews, or as a bed to braise foods, such as meats or fish. Different versions include a white mirepoix, where carrots are omitted and mushrooms or parsnips are added, or the addition of ham or bacon to the mix.","In French cooking, mirepoix is a mixture of diced carrots, onions, celery, and herbs that is sauteed in butter. It is often used to season soups, sauces, and stews, or as a bed to braise foods, such as meats or fish. Different versions include a white mirepoix, where carrots are omitted and mushrooms or parsnips are added, or the addition of ham or bacon to the mix.","Modern cars come standard with brakes on all four wheels. In 1922, Rickenbacker Motors was the first company to offer four-wheel brakes on mid-priced cars. Rival companies, including Ford, ran smear ads claiming four-wheel brakes were more dangerous than two-wheel brakes, to avoid losing business.","Modern cars come standard with brakes on all four wheels. In 1922, Rickenbacker Motors was the first company to offer four-wheel brakes on mid-priced cars. Rival companies, including Ford, ran smear ads claiming four-wheel brakes were more dangerous than two-wheel brakes, to avoid losing business.","Modern cars come standard with brakes on all four wheels. In 1922, Rickenbacker Motors was the first company to offer four-wheel brakes on mid-priced cars. Rival companies, including Ford, ran smear ads claiming four-wheel brakes were more dangerous than two-wheel brakes, to avoid losing business.","During the Late Cretaceous period, the Quetzalcoatlus, likely the largest flying vertebrate of all time, dominated the skies. Measuring up to 16 ft/5 m tall and 500 lb/200 kg, the gigantic pterosaur was reconstructed from fossil fragments found in Big Bend National Park in modern-day Texas. It is speculated that Quetzalcoatlus could glide at a high altitude, possibly covering thousands of miles in one flight.","During the Late Cretaceous period, the Quetzalcoatlus, likely the largest flying vertebrate of all time, dominated the skies. Measuring up to 16 ft/5 m tall and 500 lb/200 kg, the gigantic pterosaur was reconstructed from fossil fragments found in Big Bend National Park in modern-day Texas. It is speculated that Quetzalcoatlus could glide at a high altitude, possibly covering thousands of miles in one flight.","During the Late Cretaceous period, the Quetzalcoatlus, likely the largest flying vertebrate of all time, dominated the skies. Measuring up to 16 ft/5 m tall and 500 lb/200 kg, the gigantic pterosaur was reconstructed from fossil fragments found in Big Bend National Park in modern-day Texas. It is speculated that Quetzalcoatlus could glide at a high altitude, possibly covering thousands of miles in one flight.",cook30.mp3,cook30.mp3,cook30.mp3,cars30.mp3,cars30.mp3,cars30.mp3,dino30.mp3,dino30.mp3,dino30.mp3,cook30a.jpeg,cook30a.jpeg,cook30a.jpeg,cars30a.jpeg,cars30a.jpeg,cars30a.jpeg,dino30a.png,dino30a.png,dino30a.png,cook30b.jpeg,cook30b.jpeg,cook30b.jpeg,cars30b.jpeg,cars30b.jpeg,cars30b.jpeg,dino30b.png,dino30b.png,dino30b.png
memorise_secondhalf,61,academic,31,"Chain mail armor, which dates back as early as the 5th century BCE, was commonly worn in medieval Europe over the neck and body. One piece of a typical suit of mail armor was the aventail, a mail collar attached to the bottom of the helmet that hung over and protected the chin, neck, and shoulders.","The ancient Greek aulos was a double-piped reed instrument that likely sounded like a modern bagpipe. The aulos' two pipes were of different lengths and were played simultaneously, one with each hand. Aulos players are often depicted in Greek art with a horse halter-like strap holding the instrument to their mouth, suggesting that the aulos took so much force to blow into that a halter was necessary to hold it in place.","While most gemstones are crystals of a single compound, some are ""solid solutions"" where molecules of two or more compounds form into an intertwined crystal lattice. For example, peridot is a solid solution gemstone, composed of a blend of magnesium silicate and iron silicate. Peridot is usually mostly magnesium silicate, but it can be difficult to measure the exact percentages in a given gem.","Chain mail armor, which dates back as early as the 5th century BCE, was commonly worn in medieval Europe over the neck and body. One piece of a typical suit of mail armor was the aventail, a mail collar attached to the bottom of the helmet that hung over and protected the chin, neck, and shoulders.","The ancient Greek aulos was a double-piped reed instrument that likely sounded like a modern bagpipe. The aulos' two pipes were of different lengths and were played simultaneously, one with each hand. Aulos players are often depicted in Greek art with a horse halter-like strap holding the instrument to their mouth, suggesting that the aulos took so much force to blow into that a halter was necessary to hold it in place.","While most gemstones are crystals of a single compound, some are ""solid solutions"" where molecules of two or more compounds form into an intertwined crystal lattice. For example, peridot is a solid solution gemstone, composed of a blend of magnesium silicate and iron silicate. Peridot is usually mostly magnesium silicate, but it can be difficult to measure the exact percentages in a given gem.","Chain mail armor, which dates back as early as the 5th century BCE, was commonly worn in medieval Europe over the neck and body. One piece of a typical suit of mail armor was the aventail, a mail collar attached to the bottom of the helmet that hung over and protected the chin, neck, and shoulders.","The ancient Greek aulos was a double-piped reed instrument that likely sounded like a modern bagpipe. The aulos' two pipes were of different lengths and were played simultaneously, one with each hand. Aulos players are often depicted in Greek art with a horse halter-like strap holding the instrument to their mouth, suggesting that the aulos took so much force to blow into that a halter was necessary to hold it in place.","While most gemstones are crystals of a single compound, some are ""solid solutions"" where molecules of two or more compounds form into an intertwined crystal lattice. For example, peridot is a solid solution gemstone, composed of a blend of magnesium silicate and iron silicate. Peridot is usually mostly magnesium silicate, but it can be difficult to measure the exact percentages in a given gem.",arms31.mp3,musi31.mp3,gems31.mp3,arms31.mp3,musi31.mp3,gems31.mp3,arms31.mp3,musi31.mp3,gems31.mp3,arms31a.png,musi31a.jpeg,gems31a.png,arms31a.png,musi31a.jpeg,gems31a.png,arms31a.png,musi31a.jpeg,gems31a.png,arms31b.png,musi31b.jpeg,gems31b.png,arms31b.png,musi31b.jpeg,gems31b.png,arms31b.png,musi31b.jpeg,gems31b.png
memorise_secondhalf,62,nonacademic,31,"A fumet is a concentrated stock made from fish. Traditional fumet is a light-colored stock, so it is only made from white fish, whose bones must be cleaned carefully to avoid imparting dark impurities to the final stock. Additionally, only white or green-colored vegetables are used to flavor the stock.","A fumet is a concentrated stock made from fish. Traditional fumet is a light-colored stock, so it is only made from white fish, whose bones must be cleaned carefully to avoid imparting dark impurities to the final stock. Additionally, only white or green-colored vegetables are used to flavor the stock.","A fumet is a concentrated stock made from fish. Traditional fumet is a light-colored stock, so it is only made from white fish, whose bones must be cleaned carefully to avoid imparting dark impurities to the final stock. Additionally, only white or green-colored vegetables are used to flavor the stock.","Modern cars have disc brakes on the front wheels, and drum brakes on the back wheels. Disc brakes are stronger, so they are installed on the front wheels, which bear most of the car's stopping power. However, disc brakes are more expensive to manufacture, so mid-priced cars usually have cheaper drum brakes on the back wheels.","Modern cars have disc brakes on the front wheels, and drum brakes on the back wheels. Disc brakes are stronger, so they are installed on the front wheels, which bear most of the car's stopping power. However, disc brakes are more expensive to manufacture, so mid-priced cars usually have cheaper drum brakes on the back wheels.","Modern cars have disc brakes on the front wheels, and drum brakes on the back wheels. Disc brakes are stronger, so they are installed on the front wheels, which bear most of the car's stopping power. However, disc brakes are more expensive to manufacture, so mid-priced cars usually have cheaper drum brakes on the back wheels.","The Archaeopteryx was the first bird to be discovered by humans in fossil form. In 1861, blocks of limestone in Germany were split to reveal an almost-perfect skeleton of the bird, dating from the Late Jurassic period, complete with imprints of the feathers. It is estimated that Archaeopteryx was the size of a modern pigeon, with a long bony tail and a small head.","The Archaeopteryx was the first bird to be discovered by humans in fossil form. In 1861, blocks of limestone in Germany were split to reveal an almost-perfect skeleton of the bird, dating from the Late Jurassic period, complete with imprints of the feathers. It is estimated that Archaeopteryx was the size of a modern pigeon, with a long bony tail and a small head.","The Archaeopteryx was the first bird to be discovered by humans in fossil form. In 1861, blocks of limestone in Germany were split to reveal an almost-perfect skeleton of the bird, dating from the Late Jurassic period, complete with imprints of the feathers. It is estimated that Archaeopteryx was the size of a modern pigeon, with a long bony tail and a small head.",cook31.mp3,cook31.mp3,cook31.mp3,cars31.mp3,cars31.mp3,cars31.mp3,dino31.mp3,dino31.mp3,dino31.mp3,cook31a.jpeg,cook31a.jpeg,cook31a.jpeg,cars31a.jpeg,cars31a.jpeg,cars31a.jpeg,dino31a.jpeg,dino31a.jpeg,dino31a.jpeg,cook31b.jpeg,cook31b.jpeg,cook31b.jpeg,cars31b.jpeg,cars31b.jpeg,cars31b.jpeg,dino31b.png,dino31b.png,dino31b.png
memorise_secondhalf,63,academic,32,"A medieval knight's largest item of mail armor was a knee-length mail shirt, or hauberk. To cushion the body against additional blunt trauma, a knight would wear a padded shirt called a gambesonunder his hauberk. Poorer foot soldiers might wear a gambeson alone, which provided some protection, though not as much as additional chain mail would.","The duduk is an Armenian double reed instrument played since at least the fifth century CE. It is traditionally made from apricot wood, with a sound similar to that of an English horn. While distinctly Armenian, the duduk features quite frequently in soundtracks for Western films and TV, like Gladiator and Game of Thrones, for its otherworldly tone.","Solid solution crystals can separate, in a process called exsolution, if their temperature cools. Exsolution occurs as the over-sized ions of a solution are forced out when the cooling crystal contracts, causing the crystal to unmix. For example, moonstone is made of thin layers of albite and orthoclase feldspar. They form a solid solution inside the earth, but at surface temperatures they separate into interleaved layers of crystals, giving moonstone its iridescent effect.","A medieval knight's largest item of mail armor was a knee-length mail shirt, or hauberk. To cushion the body against additional blunt trauma, a knight would wear a padded shirt called a gambesonunder his hauberk. Poorer foot soldiers might wear a gambeson alone, which provided some protection, though not as much as additional chain mail would.","The duduk is an Armenian double reed instrument played since at least the fifth century CE. It is traditionally made from apricot wood, with a sound similar to that of an English horn. While distinctly Armenian, the duduk features quite frequently in soundtracks for Western films and TV, like Gladiator and Game of Thrones, for its otherworldly tone.","Solid solution crystals can separate, in a process called exsolution, if their temperature cools. Exsolution occurs as the over-sized ions of a solution are forced out when the cooling crystal contracts, causing the crystal to unmix. For example, moonstone is made of thin layers of albite and orthoclase feldspar. They form a solid solution inside the earth, but at surface temperatures they separate into interleaved layers of crystals, giving moonstone its iridescent effect.","A medieval knight's largest item of mail armor was a knee-length mail shirt, or hauberk. To cushion the body against additional blunt trauma, a knight would wear a padded shirt called a gambesonunder his hauberk. Poorer foot soldiers might wear a gambeson alone, which provided some protection, though not as much as additional chain mail would.","The duduk is an Armenian double reed instrument played since at least the fifth century CE. It is traditionally made from apricot wood, with a sound similar to that of an English horn. While distinctly Armenian, the duduk features quite frequently in soundtracks for Western films and TV, like Gladiator and Game of Thrones, for its otherworldly tone.","Solid solution crystals can separate, in a process called exsolution, if their temperature cools. Exsolution occurs as the over-sized ions of a solution are forced out when the cooling crystal contracts, causing the crystal to unmix. For example, moonstone is made of thin layers of albite and orthoclase feldspar. They form a solid solution inside the earth, but at surface temperatures they separate into interleaved layers of crystals, giving moonstone its iridescent effect.",arms32.mp3,musi32.mp3,gems32.mp3,arms32.mp3,musi32.mp3,gems32.mp3,arms32.mp3,musi32.mp3,gems32.mp3,arms32a.png,musi32a.jpeg,gems32a.png,arms32a.png,musi32a.jpeg,gems32a.png,arms32a.png,musi32a.jpeg,gems32a.png,arms32b.png,musi32b.png,gems32b.jpeg,arms32b.png,musi32b.png,gems32b.jpeg,arms32b.png,musi32b.png,gems32b.jpeg
memorise_secondhalf,64,nonacademic,32,"Skordalia is a Greek dip, similar to hummus, made from garlic blended with a starchy base, usually pureed cooked potatoes. It is often served as a side dish, but can also be used as a dip for bread or raw vegetables. For an extra crunch, skordalia can be made with breadcrumbs or ground nuts in addition to the traditional ingredients.","Skordalia is a Greek dip, similar to hummus, made from garlic blended with a starchy base, usually pureed cooked potatoes. It is often served as a side dish, but can also be used as a dip for bread or raw vegetables. For an extra crunch, skordalia can be made with breadcrumbs or ground nuts in addition to the traditional ingredients.","Skordalia is a Greek dip, similar to hummus, made from garlic blended with a starchy base, usually pureed cooked potatoes. It is often served as a side dish, but can also be used as a dip for bread or raw vegetables. For an extra crunch, skordalia can be made with breadcrumbs or ground nuts in addition to the traditional ingredients.","Hydraulic brake systems use brake fluid to transmit force from your foot to the brakes. Brakes get very hot, so brake fluid must have a high boiling point so it can stay liquid and keep working properly. The US Department of Transportation classifies brake fluid according to chemical makeup and boiling point. Most passenger cars use DOT 3 brake fluid, while higher performance cars may use DOT 4 fluid.","Hydraulic brake systems use brake fluid to transmit force from your foot to the brakes. Brakes get very hot, so brake fluid must have a high boiling point so it can stay liquid and keep working properly. The US Department of Transportation classifies brake fluid according to chemical makeup and boiling point. Most passenger cars use DOT 3 brake fluid, while higher performance cars may use DOT 4 fluid.","Hydraulic brake systems use brake fluid to transmit force from your foot to the brakes. Brakes get very hot, so brake fluid must have a high boiling point so it can stay liquid and keep working properly. The US Department of Transportation classifies brake fluid according to chemical makeup and boiling point. Most passenger cars use DOT 3 brake fluid, while higher performance cars may use DOT 4 fluid.","The Hesperornis regalis was a flightless bird living in the Late Cretaceous period in what is today Kansas. Not only could it not fly, it totally lacked wings. Instead, it used its large feet to propel itself through water with kicking motions that allowed it to chase prey underwater. While fairly graceful in water, the bird would have likely been rather clumsy on land.","The Hesperornis regalis was a flightless bird living in the Late Cretaceous period in what is today Kansas. Not only could it not fly, it totally lacked wings. Instead, it used its large feet to propel itself through water with kicking motions that allowed it to chase prey underwater. While fairly graceful in water, the bird would have likely been rather clumsy on land.","The Hesperornis regalis was a flightless bird living in the Late Cretaceous period in what is today Kansas. Not only could it not fly, it totally lacked wings. Instead, it used its large feet to propel itself through water with kicking motions that allowed it to chase prey underwater. While fairly graceful in water, the bird would have likely been rather clumsy on land.",cook32.mp3,cook32.mp3,cook32.mp3,cars32.mp3,cars32.mp3,cars32.mp3,dino32.mp3,dino32.mp3,dino32.mp3,cook32a.jpeg,cook32a.jpeg,cook32a.jpeg,cars32a.jpeg,cars32a.jpeg,cars32a.jpeg,dino32a.jpeg,dino32a.jpeg,dino32a.jpeg,cook32b.jpeg,cook32b.jpeg,cook32b.jpeg,cars32b.jpeg,cars32b.jpeg,cars32b.jpeg,dino32b.jpeg,dino32b.jpeg,dino32b.jpeg
