display,encoding_trial_num,group,trial_num,encoding_sentence.arms_cook,encoding_sentence.musi_cook,encoding_sentence.gems_cook,encoding_sentence.arms_cars,encoding_sentence.musi_cars,encoding_sentence.gems_cars,encoding_sentence.arms_dino,encoding_sentence.musi_dino,encoding_sentence.gems_dino,mp3.arms_cook,mp3.musi_cook,mp3.gems_cook,mp3.arms_cars,mp3.musi_cars,mp3.gems_cars,mp3.arms_dino,mp3.musi_dino,mp3.gems_dino,pic_a.arms_cook,pic_a.musi_cook,pic_a.gems_cook,pic_a.arms_cars,pic_a.musi_cars,pic_a.gems_cars,pic_a.arms_dino,pic_a.musi_dino,pic_a.gems_dino,pic_b.arms_cook,pic_b.musi_cook,pic_b.gems_cook,pic_b.arms_cars,pic_b.musi_cars,pic_b.gems_cars,pic_b.arms_dino,pic_b.musi_dino,pic_b.gems_dino
memorise_secondhalf,53,academic,27,"Japanese swords were as aesthetic as they were dangerous. The hilt guards of katana and wakazashi, called tsuba, were often kept as collector's items independent of the swords they were originally mounted on. They were often decorated with geometric or floral motifs.","The electronic Hammond organ, invented in 1935, produced sound via a series of small, gear-like metal discs called tonewheels. Each tonewheel was spun by a motor near an electromagnetic coil pickup to produce an organ-like note. The original Hammond organ enjoyed success in churches and jazz clubs until the Hammond company went out of business in 1975, but Hammond organ-style synthesizers are still popular today.","Gems can be cut in a variety of ways to show off their color, clarity, and refractive ""fire"". Most faceted cuts create a distinct top and bottom half of the gem. The crown is the top section of the gem that faces toward the viewer, and the pavilion is the bottom section that sits in the gem setting. While the crown is the main visible section, the pavilion must also be carefully faceted to maximize the gem's appearance.","Japanese swords were as aesthetic as they were dangerous. The hilt guards of katana and wakazashi, called tsuba, were often kept as collector's items independent of the swords they were originally mounted on. They were often decorated with geometric or floral motifs.","The electronic Hammond organ, invented in 1935, produced sound via a series of small, gear-like metal discs called tonewheels. Each tonewheel was spun by a motor near an electromagnetic coil pickup to produce an organ-like note. The original Hammond organ enjoyed success in churches and jazz clubs until the Hammond company went out of business in 1975, but Hammond organ-style synthesizers are still popular today.","Gems can be cut in a variety of ways to show off their color, clarity, and refractive ""fire"". Most faceted cuts create a distinct top and bottom half of the gem. The crown is the top section of the gem that faces toward the viewer, and the pavilion is the bottom section that sits in the gem setting. While the crown is the main visible section, the pavilion must also be carefully faceted to maximize the gem's appearance.","Japanese swords were as aesthetic as they were dangerous. The hilt guards of katana and wakazashi, called tsuba, were often kept as collector's items independent of the swords they were originally mounted on. They were often decorated with geometric or floral motifs.","The electronic Hammond organ, invented in 1935, produced sound via a series of small, gear-like metal discs called tonewheels. Each tonewheel was spun by a motor near an electromagnetic coil pickup to produce an organ-like note. The original Hammond organ enjoyed success in churches and jazz clubs until the Hammond company went out of business in 1975, but Hammond organ-style synthesizers are still popular today.","Gems can be cut in a variety of ways to show off their color, clarity, and refractive ""fire"". Most faceted cuts create a distinct top and bottom half of the gem. The crown is the top section of the gem that faces toward the viewer, and the pavilion is the bottom section that sits in the gem setting. While the crown is the main visible section, the pavilion must also be carefully faceted to maximize the gem's appearance.",arms27.mp3,musi27.mp3,gems27.mp3,arms27.mp3,musi27.mp3,gems27.mp3,arms27.mp3,musi27.mp3,gems27.mp3,arms27a.jpeg,musi27a.png,gems27a.jpeg,arms27a.jpeg,musi27a.png,gems27a.jpeg,arms27a.jpeg,musi27a.png,gems27a.jpeg,arms27b.jpeg,musi27b.jpg,gems27b.jpeg,arms27b.jpeg,musi27b.jpg,gems27b.jpeg,arms27b.jpeg,musi27b.jpg,gems27b.jpeg
memorise_secondhalf,54,nonacademic,27,"Creamy and rich, risotto is a northern Italian rice dish where rice is cooked slowly in broth until thick. Risotto is best made with certain Italian varieties of rice with a particular starch composition. Arborio rice is more easily found in American supermarkets, but carnaroli rice is considered the ""caviar"" of risotto rices, with optimal starch content to yield firm grains of rice in a creamy sauce.","Creamy and rich, risotto is a northern Italian rice dish where rice is cooked slowly in broth until thick. Risotto is best made with certain Italian varieties of rice with a particular starch composition. Arborio rice is more easily found in American supermarkets, but carnaroli rice is considered the ""caviar"" of risotto rices, with optimal starch content to yield firm grains of rice in a creamy sauce.","Creamy and rich, risotto is a northern Italian rice dish where rice is cooked slowly in broth until thick. Risotto is best made with certain Italian varieties of rice with a particular starch composition. Arborio rice is more easily found in American supermarkets, but carnaroli rice is considered the ""caviar"" of risotto rices, with optimal starch content to yield firm grains of rice in a creamy sauce.","Modern cruise control systems use a PID control system to monitor and adjust the throttle to maintain a vehicle's speed. The PID control system monitors not only the vehicle's speed, but also its distance traveled, as well as its acceleration. This allows cruise control to maintain consistent speed not only on flat road, but also uphill or downhill, where more or less gas is needed to maintain speed.","Modern cruise control systems use a PID control system to monitor and adjust the throttle to maintain a vehicle's speed. The PID control system monitors not only the vehicle's speed, but also its distance traveled, as well as its acceleration. This allows cruise control to maintain consistent speed not only on flat road, but also uphill or downhill, where more or less gas is needed to maintain speed.","Modern cruise control systems use a PID control system to monitor and adjust the throttle to maintain a vehicle's speed. The PID control system monitors not only the vehicle's speed, but also its distance traveled, as well as its acceleration. This allows cruise control to maintain consistent speed not only on flat road, but also uphill or downhill, where more or less gas is needed to maintain speed.","The torosaurus, or bull lizard, was the largest of the long-frilled Cretaceous dinosaurs. With a 8 ft/2.6 m long skull, the torosaurus has the largest known skull of any land animal. Torosaurus was historically considered a larger relative of Triceratops, but recent research suggests they may in fact be the same species. ""Triceratops"" specimens may actually be young torosaurus.","The torosaurus, or bull lizard, was the largest of the long-frilled Cretaceous dinosaurs. With a 8 ft/2.6 m long skull, the torosaurus has the largest known skull of any land animal. Torosaurus was historically considered a larger relative of Triceratops, but recent research suggests they may in fact be the same species. ""Triceratops"" specimens may actually be young torosaurus.","The torosaurus, or bull lizard, was the largest of the long-frilled Cretaceous dinosaurs. With a 8 ft/2.6 m long skull, the torosaurus has the largest known skull of any land animal. Torosaurus was historically considered a larger relative of Triceratops, but recent research suggests they may in fact be the same species. ""Triceratops"" specimens may actually be young torosaurus.",cook27.mp3,cook27.mp3,cook27.mp3,cars27.mp3,cars27.mp3,cars27.mp3,dino27.mp3,dino27.mp3,dino27.mp3,cook27a.jpeg,cook27a.jpeg,cook27a.jpeg,cars27a.jpeg,cars27a.jpeg,cars27a.jpeg,dino27a.png,dino27a.png,dino27a.png,cook27b.png,cook27b.png,cook27b.png,cars27b.jpeg,cars27b.jpeg,cars27b.jpeg,dino27b.png,dino27b.png,dino27b.png
memorise_secondhalf,55,academic,28,"Some of the most expensive pieces of samurai arms were made with a special alloy called shakudo. Shakudo is an alloy of mostly copper and up to 10% gold, treated to form a striking indigo-black patina on the surface of the metal. Because of the gold in the alloy, shakudo was too expensive to use for decorating whole swords, and was more often used for smaller elements like tsuba.","Musical Instrument Digital Interface, or MIDI, is a standard set of digital data formats and physical ports that allow electronic instruments to communicate with each other and with computers. MIDI carries the pitch, rhythm, and timbre of each note between machines, like digitized ""written"" music. In 1981, Ikutaro Kikehashi, the founder of the Roland electronic music company, suggested the standard be called Universal Musical Interface, or UMI, but by 1982 founders from other companies voted to call it MIDI instead.","Gem cuts can usually be classified into one of two types: brilliant cuts, producing a round outline with many triangular facets, and step cuts, with a rectangular outline and facets. Brilliant cuts increase the sparkle resulting from light refracted within a gem, while step cuts can show off a gem's clarity and color. As such, brilliant cuts are very common for diamonds, while step cuts are more often used for colored stones like emerald.","Some of the most expensive pieces of samurai arms were made with a special alloy called shakudo. Shakudo is an alloy of mostly copper and up to 10% gold, treated to form a striking indigo-black patina on the surface of the metal. Because of the gold in the alloy, shakudo was too expensive to use for decorating whole swords, and was more often used for smaller elements like tsuba.","Musical Instrument Digital Interface, or MIDI, is a standard set of digital data formats and physical ports that allow electronic instruments to communicate with each other and with computers. MIDI carries the pitch, rhythm, and timbre of each note between machines, like digitized ""written"" music. In 1981, Ikutaro Kikehashi, the founder of the Roland electronic music company, suggested the standard be called Universal Musical Interface, or UMI, but by 1982 founders from other companies voted to call it MIDI instead.","Gem cuts can usually be classified into one of two types: brilliant cuts, producing a round outline with many triangular facets, and step cuts, with a rectangular outline and facets. Brilliant cuts increase the sparkle resulting from light refracted within a gem, while step cuts can show off a gem's clarity and color. As such, brilliant cuts are very common for diamonds, while step cuts are more often used for colored stones like emerald.","Some of the most expensive pieces of samurai arms were made with a special alloy called shakudo. Shakudo is an alloy of mostly copper and up to 10% gold, treated to form a striking indigo-black patina on the surface of the metal. Because of the gold in the alloy, shakudo was too expensive to use for decorating whole swords, and was more often used for smaller elements like tsuba.","Musical Instrument Digital Interface, or MIDI, is a standard set of digital data formats and physical ports that allow electronic instruments to communicate with each other and with computers. MIDI carries the pitch, rhythm, and timbre of each note between machines, like digitized ""written"" music. In 1981, Ikutaro Kikehashi, the founder of the Roland electronic music company, suggested the standard be called Universal Musical Interface, or UMI, but by 1982 founders from other companies voted to call it MIDI instead.","Gem cuts can usually be classified into one of two types: brilliant cuts, producing a round outline with many triangular facets, and step cuts, with a rectangular outline and facets. Brilliant cuts increase the sparkle resulting from light refracted within a gem, while step cuts can show off a gem's clarity and color. As such, brilliant cuts are very common for diamonds, while step cuts are more often used for colored stones like emerald.",arms28.mp3,musi28.mp3,gems28.mp3,arms28.mp3,musi28.mp3,gems28.mp3,arms28.mp3,musi28.mp3,gems28.mp3,arms28a.jpeg,musi28a.png,gems28a.jpeg,arms28a.jpeg,musi28a.png,gems28a.jpeg,arms28a.jpeg,musi28a.png,gems28a.jpeg,arms28b.jpeg,musi28b.png,gems28b.jpeg,arms28b.jpeg,musi28b.png,gems28b.jpeg,arms28b.jpeg,musi28b.png,gems28b.jpeg
memorise_secondhalf,56,nonacademic,28,"Neither sweet, nor a type of bread, sweetbreads are animal glands, coming from the thymus and pancreas of livestock mammals. The most favored sweetbreads are taken from milk-fed calves. These perishable animal products must first be soaked in acidulated water to remove the outer membrane before cooking.","Neither sweet, nor a type of bread, sweetbreads are animal glands, coming from the thymus and pancreas of livestock mammals. The most favored sweetbreads are taken from milk-fed calves. These perishable animal products must first be soaked in acidulated water to remove the outer membrane before cooking.","Neither sweet, nor a type of bread, sweetbreads are animal glands, coming from the thymus and pancreas of livestock mammals. The most favored sweetbreads are taken from milk-fed calves. These perishable animal products must first be soaked in acidulated water to remove the outer membrane before cooking.","Gasoline contains a mix of hydrocarbons, primarily octane and heptane. Octane is more expensive, but heptane is more likely to ignite unpredictably inside an engine cylinder, producing engine ""knocking"" and reduced power. The octane rating of gasoline measures the octane-heptane ratio. Higher rating gasoline is more expensive, but provides better performance.","Gasoline contains a mix of hydrocarbons, primarily octane and heptane. Octane is more expensive, but heptane is more likely to ignite unpredictably inside an engine cylinder, producing engine ""knocking"" and reduced power. The octane rating of gasoline measures the octane-heptane ratio. Higher rating gasoline is more expensive, but provides better performance.","Gasoline contains a mix of hydrocarbons, primarily octane and heptane. Octane is more expensive, but heptane is more likely to ignite unpredictably inside an engine cylinder, producing engine ""knocking"" and reduced power. The octane rating of gasoline measures the octane-heptane ratio. Higher rating gasoline is more expensive, but provides better performance.","Many theropod dinosaurs likely had some type of proto-feathers on most of their bodies. Unfortunately, dinosaurs larger than a foot or two tend to fossilize under conditions that do not preserve feather imprints, making confirmation difficult. However, one species of Velociraptor has been found with quill knobs, or bumps on its forearm bones where ligaments would attach to feathers. This provides evidence of feathers even without fossilized imprints.","Many theropod dinosaurs likely had some type of proto-feathers on most of their bodies. Unfortunately, dinosaurs larger than a foot or two tend to fossilize under conditions that do not preserve feather imprints, making confirmation difficult. However, one species of Velociraptor has been found with quill knobs, or bumps on its forearm bones where ligaments would attach to feathers. This provides evidence of feathers even without fossilized imprints.","Many theropod dinosaurs likely had some type of proto-feathers on most of their bodies. Unfortunately, dinosaurs larger than a foot or two tend to fossilize under conditions that do not preserve feather imprints, making confirmation difficult. However, one species of Velociraptor has been found with quill knobs, or bumps on its forearm bones where ligaments would attach to feathers. This provides evidence of feathers even without fossilized imprints.",cook28.mp3,cook28.mp3,cook28.mp3,cars28.mp3,cars28.mp3,cars28.mp3,dino28.mp3,dino28.mp3,dino28.mp3,cook28a.jpeg,cook28a.jpeg,cook28a.jpeg,cars28a.jpeg,cars28a.jpeg,cars28a.jpeg,dino28a.jpeg,dino28a.jpeg,dino28a.jpeg,cook28b.jpeg,cook28b.jpeg,cook28b.jpeg,cars28b.jpeg,cars28b.jpeg,cars28b.jpeg,dino28b.png,dino28b.png,dino28b.png
memorise_secondhalf,57,academic,29,"Armor often serves to intimidate enemies as well as protect against attack. The Japanese samurai helmet, or kabuto, was fastened to an ornamental face mask, called men-yoroi, made of leather and/or iron. The men-yoroi often had decorative elements attached, such as a thick horsehair mustache.","The vocoder was the first musical instrument used to create the ""robot voice"" effect now popular in modern music. The vocoder was originally developed by Bell Labs to encrypt voice messages sent during World War II. By the 1970s the vocoder was eventually co-opted by musicians to make synthesizer tones sound like human speech, and it is now used almost exclusively as a musical instrument.","Many gemstones are not ""solid"", but instead contain inclusions of other crystals, or perhaps bubbles of some other liquid or gas. Certain crystal inclusions increase the beauty (and price) of a gem, but inclusions like gas bubbles are a red flag for synthetic stones, and thus can decrease gem value. Gemologists can inspect gems and their inclusions with a loupe, a small high-powered magnifying glass.","Armor often serves to intimidate enemies as well as protect against attack. The Japanese samurai helmet, or kabuto, was fastened to an ornamental face mask, called men-yoroi, made of leather and/or iron. The men-yoroi often had decorative elements attached, such as a thick horsehair mustache.","The vocoder was the first musical instrument used to create the ""robot voice"" effect now popular in modern music. The vocoder was originally developed by Bell Labs to encrypt voice messages sent during World War II. By the 1970s the vocoder was eventually co-opted by musicians to make synthesizer tones sound like human speech, and it is now used almost exclusively as a musical instrument.","Many gemstones are not ""solid"", but instead contain inclusions of other crystals, or perhaps bubbles of some other liquid or gas. Certain crystal inclusions increase the beauty (and price) of a gem, but inclusions like gas bubbles are a red flag for synthetic stones, and thus can decrease gem value. Gemologists can inspect gems and their inclusions with a loupe, a small high-powered magnifying glass.","Armor often serves to intimidate enemies as well as protect against attack. The Japanese samurai helmet, or kabuto, was fastened to an ornamental face mask, called men-yoroi, made of leather and/or iron. The men-yoroi often had decorative elements attached, such as a thick horsehair mustache.","The vocoder was the first musical instrument used to create the ""robot voice"" effect now popular in modern music. The vocoder was originally developed by Bell Labs to encrypt voice messages sent during World War II. By the 1970s the vocoder was eventually co-opted by musicians to make synthesizer tones sound like human speech, and it is now used almost exclusively as a musical instrument.","Many gemstones are not ""solid"", but instead contain inclusions of other crystals, or perhaps bubbles of some other liquid or gas. Certain crystal inclusions increase the beauty (and price) of a gem, but inclusions like gas bubbles are a red flag for synthetic stones, and thus can decrease gem value. Gemologists can inspect gems and their inclusions with a loupe, a small high-powered magnifying glass.",arms29.mp3,musi29.mp3,gems29.mp3,arms29.mp3,musi29.mp3,gems29.mp3,arms29.mp3,musi29.mp3,gems29.mp3,arms29a.png,musi29a.jpg,gems29a.png,arms29a.png,musi29a.jpg,gems29a.png,arms29a.png,musi29a.jpg,gems29a.png,arms29b.png,musi29b.jpg,gems29b.jpeg,arms29b.png,musi29b.jpg,gems29b.jpeg,arms29b.png,musi29b.jpg,gems29b.jpeg
memorise_secondhalf,58,nonacademic,29,"A common Japanese deep-frying technique is tempura, where vegetables and seafood are coated in a light batter before frying. Tempura frying was introduced to Japan by Portuguese Catholic missionaries in the 16th century. The name ""tempura"" comes from the Latin term for the holy days when Catholics abstained from meat, eating foods like tempura instead.","A common Japanese deep-frying technique is tempura, where vegetables and seafood are coated in a light batter before frying. Tempura frying was introduced to Japan by Portuguese Catholic missionaries in the 16th century. The name ""tempura"" comes from the Latin term for the holy days when Catholics abstained from meat, eating foods like tempura instead.","A common Japanese deep-frying technique is tempura, where vegetables and seafood are coated in a light batter before frying. Tempura frying was introduced to Japan by Portuguese Catholic missionaries in the 16th century. The name ""tempura"" comes from the Latin term for the holy days when Catholics abstained from meat, eating foods like tempura instead.","Some compounds may be added to cheaper, low-octane gasoline to improve performance. In the 1920s, US oil companies began adding tetraethyl lead to produce leaded gasoline. While this additive was clearly toxic to oil refinery workers and the general public, oil company lobbying kept leaded gasoline legal until 1986.","Some compounds may be added to cheaper, low-octane gasoline to improve performance. In the 1920s, US oil companies began adding tetraethyl lead to produce leaded gasoline. While this additive was clearly toxic to oil refinery workers and the general public, oil company lobbying kept leaded gasoline legal until 1986.","Some compounds may be added to cheaper, low-octane gasoline to improve performance. In the 1920s, US oil companies began adding tetraethyl lead to produce leaded gasoline. While this additive was clearly toxic to oil refinery workers and the general public, oil company lobbying kept leaded gasoline legal until 1986.","Like dinosaurs, flying pterosaurs like the famous Pteranodon were probably not as smooth-skinned as they have been depicted in pop culture. Pterosaurs may have been covered in pycnofibers, thin keratin filaments somewhat similar both to hair and to feathers. Pycnofibers do not seem to share a common evolutionary origin with either mammal fur or dinosaur and bird feathers, but appear to be the result of convergent evolution.","Like dinosaurs, flying pterosaurs like the famous Pteranodon were probably not as smooth-skinned as they have been depicted in pop culture. Pterosaurs may have been covered in pycnofibers, thin keratin filaments somewhat similar both to hair and to feathers. Pycnofibers do not seem to share a common evolutionary origin with either mammal fur or dinosaur and bird feathers, but appear to be the result of convergent evolution.","Like dinosaurs, flying pterosaurs like the famous Pteranodon were probably not as smooth-skinned as they have been depicted in pop culture. Pterosaurs may have been covered in pycnofibers, thin keratin filaments somewhat similar both to hair and to feathers. Pycnofibers do not seem to share a common evolutionary origin with either mammal fur or dinosaur and bird feathers, but appear to be the result of convergent evolution.",cook29.mp3,cook29.mp3,cook29.mp3,cars29.mp3,cars29.mp3,cars29.mp3,dino29.mp3,dino29.mp3,dino29.mp3,cook29a.jpeg,cook29a.jpeg,cook29a.jpeg,cars29a.jpeg,cars29a.jpeg,cars29a.jpeg,dino29a.png,dino29a.png,dino29a.png,cook29b.jpeg,cook29b.jpeg,cook29b.jpeg,cars29b.jpeg,cars29b.jpeg,cars29b.jpeg,dino29b.jpeg,dino29b.jpeg,dino29b.jpeg
