display,encoding_trial_num,group,trial_num,encoding_sentence.arms_cook,encoding_sentence.musi_cook,encoding_sentence.gems_cook,encoding_sentence.arms_cars,encoding_sentence.musi_cars,encoding_sentence.gems_cars,encoding_sentence.arms_dino,encoding_sentence.musi_dino,encoding_sentence.gems_dino,mp3.arms_cook,mp3.musi_cook,mp3.gems_cook,mp3.arms_cars,mp3.musi_cars,mp3.gems_cars,mp3.arms_dino,mp3.musi_dino,mp3.gems_dino,pic_a.arms_cook,pic_a.musi_cook,pic_a.gems_cook,pic_a.arms_cars,pic_a.musi_cars,pic_a.gems_cars,pic_a.arms_dino,pic_a.musi_dino,pic_a.gems_dino,pic_b.arms_cook,pic_b.musi_cook,pic_b.gems_cook,pic_b.arms_cars,pic_b.musi_cars,pic_b.gems_cars,pic_b.arms_dino,pic_b.musi_dino,pic_b.gems_dino
memorise_secondhalf,65,academic,33,"Poorer medieval soldiers did have some armor options available to them. Another less expensive material for medieval European armor was cuir bouilli, or ""boiled leather"". Leather could be treated with hot water and molded until dry, resulting in a hardened final product that could resist some blows. The term ""cuirass"" for an armor breastplate probably shares a word root with cuir bouilli, suggesting that breastplates were often made from boiled leather.","The oliphant was a medieval hunting horn made from hollowed-out elephant tusk. It likely originated around the Mediterranean or north Africa, and was introduced to western Europe via the Crusades. Perhaps the most famous mythical oliphant belonged to the legendary knight Roland of The Song of Roland, who waited too long to blow his oliphant to call for help in battle and doomed his men to defeat.","Inclusions of rutile at 120-degree angles in gems like sapphire and garnet can produce an attractive pattern in the stone, where a six-rayed star appears when light is shone on the stone. Asterism is the technical term for this star-shaped pattern. Asterism can be reflected, producing a star on top of the stone, refracted, producing a star within the stone, or sometimes both in the same stone.","Poorer medieval soldiers did have some armor options available to them. Another less expensive material for medieval European armor was cuir bouilli, or ""boiled leather"". Leather could be treated with hot water and molded until dry, resulting in a hardened final product that could resist some blows. The term ""cuirass"" for an armor breastplate probably shares a word root with cuir bouilli, suggesting that breastplates were often made from boiled leather.","The oliphant was a medieval hunting horn made from hollowed-out elephant tusk. It likely originated around the Mediterranean or north Africa, and was introduced to western Europe via the Crusades. Perhaps the most famous mythical oliphant belonged to the legendary knight Roland of The Song of Roland, who waited too long to blow his oliphant to call for help in battle and doomed his men to defeat.","Inclusions of rutile at 120-degree angles in gems like sapphire and garnet can produce an attractive pattern in the stone, where a six-rayed star appears when light is shone on the stone. Asterism is the technical term for this star-shaped pattern. Asterism can be reflected, producing a star on top of the stone, refracted, producing a star within the stone, or sometimes both in the same stone.","Poorer medieval soldiers did have some armor options available to them. Another less expensive material for medieval European armor was cuir bouilli, or ""boiled leather"". Leather could be treated with hot water and molded until dry, resulting in a hardened final product that could resist some blows. The term ""cuirass"" for an armor breastplate probably shares a word root with cuir bouilli, suggesting that breastplates were often made from boiled leather.","The oliphant was a medieval hunting horn made from hollowed-out elephant tusk. It likely originated around the Mediterranean or north Africa, and was introduced to western Europe via the Crusades. Perhaps the most famous mythical oliphant belonged to the legendary knight Roland of The Song of Roland, who waited too long to blow his oliphant to call for help in battle and doomed his men to defeat.","Inclusions of rutile at 120-degree angles in gems like sapphire and garnet can produce an attractive pattern in the stone, where a six-rayed star appears when light is shone on the stone. Asterism is the technical term for this star-shaped pattern. Asterism can be reflected, producing a star on top of the stone, refracted, producing a star within the stone, or sometimes both in the same stone.",arms33.mp3,musi33.mp3,gems33.mp3,arms33.mp3,musi33.mp3,gems33.mp3,arms33.mp3,musi33.mp3,gems33.mp3,arms33a.jpeg,musi33a.jpeg,gems33a.png,arms33a.jpeg,musi33a.jpeg,gems33a.png,arms33a.jpeg,musi33a.jpeg,gems33a.png,arms33b.png,musi33b.png,gems33b.jpeg,arms33b.png,musi33b.png,gems33b.jpeg,arms33b.png,musi33b.png,gems33b.jpeg
memorise_secondhalf,66,nonacademic,33,"Nearly all conventional melons belong to the same species, Cucumis melo, or the muskmelon. Cantaloupes belong to one subspecies of muskmelon, cantalupensis, while honeydew and many other melons common in Asia belong to another subspecies, inodorus.","Nearly all conventional melons belong to the same species, Cucumis melo, or the muskmelon. Cantaloupes belong to one subspecies of muskmelon, cantalupensis, while honeydew and many other melons common in Asia belong to another subspecies, inodorus.","Nearly all conventional melons belong to the same species, Cucumis melo, or the muskmelon. Cantaloupes belong to one subspecies of muskmelon, cantalupensis, while honeydew and many other melons common in Asia belong to another subspecies, inodorus.","The parking brake, or emergency brake, system operates independently of the main brake system. Engaging the emergency brake pulls a set of cables that push the brake shoes down, keeping the car stopped. Fully mechanical emergency brakes are usually installed on drum brakes, where mechanical brakes are easier to install, rather than disc brakes.","The parking brake, or emergency brake, system operates independently of the main brake system. Engaging the emergency brake pulls a set of cables that push the brake shoes down, keeping the car stopped. Fully mechanical emergency brakes are usually installed on drum brakes, where mechanical brakes are easier to install, rather than disc brakes.","The parking brake, or emergency brake, system operates independently of the main brake system. Engaging the emergency brake pulls a set of cables that push the brake shoes down, keeping the car stopped. Fully mechanical emergency brakes are usually installed on drum brakes, where mechanical brakes are easier to install, rather than disc brakes.","The Aepyornis, or ""elephant bird"", was a large flightless bird native to Madagascar that went extinct relatively recently, around 1000 years ago. Aepyornis's nickname came from the its similarity to the roc, a bird from Arabic legend that was supposedly large enough to carry off an elephant. The real elephant bird, earning its name, weighed up to 1000 lb/450 kg and laid eggs that were over 1 ft/30 cm long.","The Aepyornis, or ""elephant bird"", was a large flightless bird native to Madagascar that went extinct relatively recently, around 1000 years ago. Aepyornis's nickname came from the its similarity to the roc, a bird from Arabic legend that was supposedly large enough to carry off an elephant. The real elephant bird, earning its name, weighed up to 1000 lb/450 kg and laid eggs that were over 1 ft/30 cm long.","The Aepyornis, or ""elephant bird"", was a large flightless bird native to Madagascar that went extinct relatively recently, around 1000 years ago. Aepyornis's nickname came from the its similarity to the roc, a bird from Arabic legend that was supposedly large enough to carry off an elephant. The real elephant bird, earning its name, weighed up to 1000 lb/450 kg and laid eggs that were over 1 ft/30 cm long.",cook33.mp3,cook33.mp3,cook33.mp3,cars33.mp3,cars33.mp3,cars33.mp3,dino33.mp3,dino33.mp3,dino33.mp3,cook33a.jpeg,cook33a.jpeg,cook33a.jpeg,cars33a.jpeg,cars33a.jpeg,cars33a.jpeg,dino33a.jpeg,dino33a.jpeg,dino33a.jpeg,cook33b.jpeg,cook33b.jpeg,cook33b.jpeg,cars33b.jpeg,cars33b.jpeg,cars33b.jpeg,dino33b.jpeg,dino33b.jpeg,dino33b.jpeg
memorise_secondhalf,67,academic,34,"In 15th and 16th century Europe, plate armor was the most popular form of protection in battle. A full suit of armor was composed of several pieces to cover various body parts, from the head all the way down to the feet, which were protected with shoe-like covers called sabatons.","Free-reed instruments, like the harmonica, have a series of reeds built to vibrate at a fixed set of pitches when air is passed through. The Chinese sheng is one of the oldest free-reed instruments, recorded as early as the 7th century BCE, composed of a cluster of bamboo reeded pipes attached to a mouthpiece. The sheng is played by covering and uncovering holes at the base of each pipe to determine which pitches sound.","Rutile inclusions are responsible for other reflective and refractive patterns as well. If the inclusions are all parallel to one another, a single reflective stripe appears on the stone, creating chatoyancy, or a ""cat's eye"", effect. Chatoyancy can form in many gem varieties, but chrysoberyl is most commonly associated with the cat's eye effect.","In 15th and 16th century Europe, plate armor was the most popular form of protection in battle. A full suit of armor was composed of several pieces to cover various body parts, from the head all the way down to the feet, which were protected with shoe-like covers called sabatons.","Free-reed instruments, like the harmonica, have a series of reeds built to vibrate at a fixed set of pitches when air is passed through. The Chinese sheng is one of the oldest free-reed instruments, recorded as early as the 7th century BCE, composed of a cluster of bamboo reeded pipes attached to a mouthpiece. The sheng is played by covering and uncovering holes at the base of each pipe to determine which pitches sound.","Rutile inclusions are responsible for other reflective and refractive patterns as well. If the inclusions are all parallel to one another, a single reflective stripe appears on the stone, creating chatoyancy, or a ""cat's eye"", effect. Chatoyancy can form in many gem varieties, but chrysoberyl is most commonly associated with the cat's eye effect.","In 15th and 16th century Europe, plate armor was the most popular form of protection in battle. A full suit of armor was composed of several pieces to cover various body parts, from the head all the way down to the feet, which were protected with shoe-like covers called sabatons.","Free-reed instruments, like the harmonica, have a series of reeds built to vibrate at a fixed set of pitches when air is passed through. The Chinese sheng is one of the oldest free-reed instruments, recorded as early as the 7th century BCE, composed of a cluster of bamboo reeded pipes attached to a mouthpiece. The sheng is played by covering and uncovering holes at the base of each pipe to determine which pitches sound.","Rutile inclusions are responsible for other reflective and refractive patterns as well. If the inclusions are all parallel to one another, a single reflective stripe appears on the stone, creating chatoyancy, or a ""cat's eye"", effect. Chatoyancy can form in many gem varieties, but chrysoberyl is most commonly associated with the cat's eye effect.",arms34.mp3,musi34.mp3,gems34.mp3,arms34.mp3,musi34.mp3,gems34.mp3,arms34.mp3,musi34.mp3,gems34.mp3,arms34a.png,musi34a.png,gems34a.jpeg,arms34a.png,musi34a.png,gems34a.jpeg,arms34a.png,musi34a.png,gems34a.jpeg,arms34b.png,musi34b.png,gems34b.png,arms34b.png,musi34b.png,gems34b.png,arms34b.png,musi34b.png,gems34b.png
memorise_secondhalf,68,nonacademic,34,"Made from unripe fruit, a verjus is an acidic liquid coming from the French phrase for ""green juice."" Traditionally, the juice comes from semi-ripe wine grapes with high acid and low sugar content, thinned from the vines. Unlike wine, verjus is not fermented, so it is non-alcoholic. It is often used to heighten the flavor of sauces and mustards, similar to vinegar but more gentle.","Made from unripe fruit, a verjus is an acidic liquid coming from the French phrase for ""green juice."" Traditionally, the juice comes from semi-ripe wine grapes with high acid and low sugar content, thinned from the vines. Unlike wine, verjus is not fermented, so it is non-alcoholic. It is often used to heighten the flavor of sauces and mustards, similar to vinegar but more gentle.","Made from unripe fruit, a verjus is an acidic liquid coming from the French phrase for ""green juice."" Traditionally, the juice comes from semi-ripe wine grapes with high acid and low sugar content, thinned from the vines. Unlike wine, verjus is not fermented, so it is non-alcoholic. It is often used to heighten the flavor of sauces and mustards, similar to vinegar but more gentle.","Large trucks need extra help braking, and often use engine brakes to help slow them down. Engine brakes release air from the cylinders to exhaust before combustion occurs, reducing the engine's power. Many engine brake systems are made by Jacobs Vehicle Systems, earning all engine brakes the nickname ""Jake brakes"".","Large trucks need extra help braking, and often use engine brakes to help slow them down. Engine brakes release air from the cylinders to exhaust before combustion occurs, reducing the engine's power. Many engine brake systems are made by Jacobs Vehicle Systems, earning all engine brakes the nickname ""Jake brakes"".","Large trucks need extra help braking, and often use engine brakes to help slow them down. Engine brakes release air from the cylinders to exhaust before combustion occurs, reducing the engine's power. Many engine brake systems are made by Jacobs Vehicle Systems, earning all engine brakes the nickname ""Jake brakes"".","Mary Anning was one of the most prolific fossil collectors and paleontologists in 19th-century England, even though she was excluded from the Geological Society of London on account of her gender. Anning lived in Dorset, England along what is now known as the Jurassic Coast for its many fossils. She started early; in 1811 at age 12 she discovered a crocodile-like fossil that was eventually recognized as the first recorded Ichthyosaurus.","Mary Anning was one of the most prolific fossil collectors and paleontologists in 19th-century England, even though she was excluded from the Geological Society of London on account of her gender. Anning lived in Dorset, England along what is now known as the Jurassic Coast for its many fossils. She started early; in 1811 at age 12 she discovered a crocodile-like fossil that was eventually recognized as the first recorded Ichthyosaurus.","Mary Anning was one of the most prolific fossil collectors and paleontologists in 19th-century England, even though she was excluded from the Geological Society of London on account of her gender. Anning lived in Dorset, England along what is now known as the Jurassic Coast for its many fossils. She started early; in 1811 at age 12 she discovered a crocodile-like fossil that was eventually recognized as the first recorded Ichthyosaurus.",cook34.mp3,cook34.mp3,cook34.mp3,cars34.mp3,cars34.mp3,cars34.mp3,dino34.mp3,dino34.mp3,dino34.mp3,cook34a.jpg,cook34a.jpg,cook34a.jpg,cars34a.jpeg,cars34a.jpeg,cars34a.jpeg,dino34a.jpeg,dino34a.jpeg,dino34a.jpeg,cook34b.jpg,cook34b.jpg,cook34b.jpg,cars34b.jpeg,cars34b.jpeg,cars34b.jpeg,dino34b.jpg,dino34b.jpg,dino34b.jpg
memorise_secondhalf,69,academic,35,"In a suit of plate armor, pauldrons protected the shoulders, as well as the armpits. In battle, this armor might be lightly padded underneath to allow for more arm mobility, but in jousting tournaments pauldrons were much more heavily padded. In jousting armor, the pauldrons might have a cutaway slot in which to rest the butt of a jousting lance held over the shoulder.","The recorder is perhaps the best-known member of the duct flute family. Duct flutes are named for the duct just below the mouthpiece at the top of the flute that allows the flute to sound. The whistle mouthpiece at the top of recorders and other duct flutes is called a fipple. Accordingly, duct flutes are also known as fipple flutes.","Asterism or chatoyancy in gems can be improved with the gem's cut. Such stones must be cut en cabochon, where they are polished into a bead with a rounded surface, instead of having flat facets. The placement of the flat back and the rounded top of the cabochon must also be carefully chosen to align with the inclusion pattern that creates the star or cat's eye to maximize the effect.","In a suit of plate armor, pauldrons protected the shoulders, as well as the armpits. In battle, this armor might be lightly padded underneath to allow for more arm mobility, but in jousting tournaments pauldrons were much more heavily padded. In jousting armor, the pauldrons might have a cutaway slot in which to rest the butt of a jousting lance held over the shoulder.","The recorder is perhaps the best-known member of the duct flute family. Duct flutes are named for the duct just below the mouthpiece at the top of the flute that allows the flute to sound. The whistle mouthpiece at the top of recorders and other duct flutes is called a fipple. Accordingly, duct flutes are also known as fipple flutes.","Asterism or chatoyancy in gems can be improved with the gem's cut. Such stones must be cut en cabochon, where they are polished into a bead with a rounded surface, instead of having flat facets. The placement of the flat back and the rounded top of the cabochon must also be carefully chosen to align with the inclusion pattern that creates the star or cat's eye to maximize the effect.","In a suit of plate armor, pauldrons protected the shoulders, as well as the armpits. In battle, this armor might be lightly padded underneath to allow for more arm mobility, but in jousting tournaments pauldrons were much more heavily padded. In jousting armor, the pauldrons might have a cutaway slot in which to rest the butt of a jousting lance held over the shoulder.","The recorder is perhaps the best-known member of the duct flute family. Duct flutes are named for the duct just below the mouthpiece at the top of the flute that allows the flute to sound. The whistle mouthpiece at the top of recorders and other duct flutes is called a fipple. Accordingly, duct flutes are also known as fipple flutes.","Asterism or chatoyancy in gems can be improved with the gem's cut. Such stones must be cut en cabochon, where they are polished into a bead with a rounded surface, instead of having flat facets. The placement of the flat back and the rounded top of the cabochon must also be carefully chosen to align with the inclusion pattern that creates the star or cat's eye to maximize the effect.",arms35.mp3,musi35.mp3,gems35.mp3,arms35.mp3,musi35.mp3,gems35.mp3,arms35.mp3,musi35.mp3,gems35.mp3,arms35a.png,musi35a.png,gems35a.jpeg,arms35a.png,musi35a.png,gems35a.jpeg,arms35a.png,musi35a.png,gems35a.jpeg,arms35b.jpeg,musi35b.jpeg,gems35b.png,arms35b.jpeg,musi35b.jpeg,gems35b.png,arms35b.jpeg,musi35b.jpeg,gems35b.png
memorise_secondhalf,70,nonacademic,35,"Often referred to as the ""browning reaction,"" the Maillard reaction is the chemical reaction between a reducing sugar and an amino acid when heating. This reaction, first explained by Louis-Camille Maillard in 1912, is responsible for the browning on steaks, toast, and many other foods, that changes the flavor and adds a crispy texture.","Often referred to as the ""browning reaction,"" the Maillard reaction is the chemical reaction between a reducing sugar and an amino acid when heating. This reaction, first explained by Louis-Camille Maillard in 1912, is responsible for the browning on steaks, toast, and many other foods, that changes the flavor and adds a crispy texture.","Often referred to as the ""browning reaction,"" the Maillard reaction is the chemical reaction between a reducing sugar and an amino acid when heating. This reaction, first explained by Louis-Camille Maillard in 1912, is responsible for the browning on steaks, toast, and many other foods, that changes the flavor and adds a crispy texture.","In order to turn a vehicle, the rotational motion of a steering wheel must be translated into the side-to-side motion of actual wheels. Most modern cars use a rack-and-pinion steering system for this purpose. Turning the steering wheel turns a pinion gear, which in turn moves the rack, a long rod connected to the wheels. When the rack moves from side to side, the wheels point left or right.","In order to turn a vehicle, the rotational motion of a steering wheel must be translated into the side-to-side motion of actual wheels. Most modern cars use a rack-and-pinion steering system for this purpose. Turning the steering wheel turns a pinion gear, which in turn moves the rack, a long rod connected to the wheels. When the rack moves from side to side, the wheels point left or right.","In order to turn a vehicle, the rotational motion of a steering wheel must be translated into the side-to-side motion of actual wheels. Most modern cars use a rack-and-pinion steering system for this purpose. Turning the steering wheel turns a pinion gear, which in turn moves the rack, a long rod connected to the wheels. When the rack moves from side to side, the wheels point left or right.","The skeleton of the Shonisaurus, the largest known ichthyosaur at up to 50 ft/15 m long, has been discovered almost in full from Late Triassic rocks in modern day Nevada. Fossils were first unearthed by miners living and working in the town of Berlin in the early 1900s. When paleontologists finally excavated the site, there were so many Shonisaurus fossils that the dig site was made into the aptly named Berlin-Ichthyosaur State Park, and the Shonisaurus was named the official fossil of Nevada.","The skeleton of the Shonisaurus, the largest known ichthyosaur at up to 50 ft/15 m long, has been discovered almost in full from Late Triassic rocks in modern day Nevada. Fossils were first unearthed by miners living and working in the town of Berlin in the early 1900s. When paleontologists finally excavated the site, there were so many Shonisaurus fossils that the dig site was made into the aptly named Berlin-Ichthyosaur State Park, and the Shonisaurus was named the official fossil of Nevada.","The skeleton of the Shonisaurus, the largest known ichthyosaur at up to 50 ft/15 m long, has been discovered almost in full from Late Triassic rocks in modern day Nevada. Fossils were first unearthed by miners living and working in the town of Berlin in the early 1900s. When paleontologists finally excavated the site, there were so many Shonisaurus fossils that the dig site was made into the aptly named Berlin-Ichthyosaur State Park, and the Shonisaurus was named the official fossil of Nevada.",cook35.mp3,cook35.mp3,cook35.mp3,cars35.mp3,cars35.mp3,cars35.mp3,dino35.mp3,dino35.mp3,dino35.mp3,cook35a.jpeg,cook35a.jpeg,cook35a.jpeg,cars35a.jpeg,cars35a.jpeg,cars35a.jpeg,dino35a.jpeg,dino35a.jpeg,dino35a.jpeg,cook35b.jpeg,cook35b.jpeg,cook35b.jpeg,cars35b.jpeg,cars35b.jpeg,cars35b.jpeg,dino35b.jpeg,dino35b.jpeg,dino35b.jpeg
